Company,Valuation ($B),Date Joined,Country,City,Industry,Select Investors,,,,,,,
Choco,$1.20 ,4/12/22,Germany,Berlin,E-commerce & direct-to-consumer,"Bessemer Venture Partners, G Squared, Insight Partners",,,,,,,
Copado,$1.20 ,9/13/21,United States,Chicago,Data management & analytics,"Insight Partners, Salesforce Ventures, Perpetual Investors",,,,,,,
DailyPay,$1.20 ,5/18/21,United States,New York,Fintech,"RPM Ventures, Inspiration Ventures, Carrick Capital Partners",,,,,,,
Fair,$1.20 ,12/20/18,United States,Santa Monica,Auto & transportation,"CreditEase Fintech Investment Fund, BMW i Ventures, SoftBank Group",,,,,,,
FloQast,$1.20 ,7/21/21,United States,Los Angeles,Fintech,"Polaris Partners, Insight Partners, Norwest Venture Partners",,,,,,,
Gem,$1.20 ,9/28/21,United States,San Francisco,Internet software & services,"Accel, Greylock Partners, Meritech Capital Partners",,,,,,,
Jokr,$1.20 ,12/2/21,United States,New York,"Supply chain, logistics, & delivery","GGV Capital, Tiger Global Management, Greycroft",,,,,,,
LivSpace,$1.20 ,2/8/22,India,Bengaluru,E-commerce & direct-to-consumer,"Jungle Ventures, Helion Venture Partners, INGKA Investments",,,,,,,
Merama,$1.20 ,12/9/21,Mexico,Mexico City,E-commerce & direct-to-consumer,"SoftBank Latin America Fund, Advent International, Balderton Capital",,,,,,,
MindTickle,$1.20 ,8/3/21,United States,San Francisco,Internet software & services,"Qualcomm Ventures, Accel, Canaan Partners",,,,,,,
MyGlamm,$1.20 ,11/10/21,India,Mumbai,E-commerce & direct-to-consumer,"L'Occitane, Trifecta Capital, Bessemer Venture Partners",,,,,,,
Nova Labs,$1.20 ,2/22/22,United States,San Francisco,Internet software & services,"FirstMark Capital, Tiger Global Management, FTX Venture",,,,,,,
Offchain Labs,$1.20 ,8/31/21,United States,Princeton,Internet software & services,"Pantera Capital, Polychain Capital, Lightspeed Venture Partners",,,,,,,
Phantom,$1.20 ,1/31/22,United States,San Francisco,Fintech,"Paradigm, Andreessen Horowitz, Jump Capital",,,,,,,
Pilot.com,$1.20 ,3/26/21,United States,San Francisco,Fintech,"Index Ventures, Sequoia Capital, Bezos Expeditions",,,,,,,
Pipa Coding,$1.20 ,3/25/21,China,Beijing,Edtech,"Source Code Capital, XVC Venture Capital, Hillhouse Capital Management",,,,,,,
Prime Medicine,$1.20 ,7/13/21,United States,Cambridge,Health,"Newpath Partners, Google Ventures, F-Prime Capital",,,,,,,
Public,$1.20 ,2/17/21,United States,New York,Fintech,"Accel, Greycroft, Advancit Capital",,,,,,,
Qumulo,$1.20 ,7/16/20,United States,Seattle,Data management & analytics,"Madrona Venture Group, Kleiner Perkins Caufield & Byers, Highland Capital Partners",,,,,,,
Rohlik Group,$1.20 ,7/1/21,Czech Republic,Prague,"Supply chain, logistics, & delivery","Partech Partners, Index Ventures, Quadrille Capital",,,,,,,
SeekOut,$1.20 ,1/12/22,United States,Bellevue,Internet software & services,"Mayfield, Madrona Venture Group, Tiger Global Management",,,,,,,
SmartMore,$1.20 ,6/24/21,China,Shenzhen,Artificial Intelligence,"IDG Capital, ZhenFund, Sequoia Capital China",,,,,,,
Spectrum Medical,$1.20 ,7/18/22,United Kingdom,Gloucester,Health,CVC Capital Partners,,,,,,,
stori,$1.20 ,7/15/22,Mexico,Juarez,Fintech,"Vision Plus Capital, Source Code Capital, Lightspeed Venture Partners",,,,,,,
Swiftly,$1.20 ,9/19/22,United States,Seattle,Mobile & telecommunications,"Mendacre, BRV Capital Management, Liquid 2 Ventures",,,,,,,
Tealium,$1.20 ,2/3/21,United States,San Diego,Internet software & services,"Georgian Partners, Silver Lake, Presidio Ventures",,,,,,,
Unit,$1.20 ,5/17/22,United States,New York,Fintech,"Accel, Better Tomorrow Ventures, Flourish Ventures",,,,,,,
Vectra Networks,$1.20 ,4/29/21,United States,San Jose,Artificial intelligence,"IA Ventures, Khosla Ventures, AME Cloud Ventures",,,,,,,
Viz.ai,$1.20 ,4/7/22,United States,San Francisco,Artificial Intelligence,"Kleiner Perkins Caufield & Byers, CRV, Threshold Ventures",,,,,,,
Workhuman,$1.20 ,6/23/20,Ireland,Dublin,Internet software & services,ICG,,,,,,,
Xpressbees,$1.20 ,2/9/22,India,Pune,"Supply chain, logistics, & delivery","Norwest Venture Partners, Investcorp, Blackstone",,,,,,,
Yiguo,$1.20 ,11/9/16,China,Shanghai,"Supply chain, logistics, & delivery","Alibaba Group, KKR, Goldman Sachs",,,,,,,
Zip,$1.20 ,5/25/22,United States,San Francisco,Fintech,"CRV, Tiger Global Management, Y Combinator",,,,,,,
L&P Cosmetic,$1.19 ,1/1/16,South Korea,Seoul,Consumer & retail,CDIB Capital,,,,,,,
Mininglamp Technology,$1.19 ,3/27/19,China,Beijing,Artificial intelligence,"Russia-China Investment Fund, Tencent Holdings, Sequoia Capital China",,,,,,,
Luoji Siwei,$1.18 ,7/20/17,China,Beijing,Edtech,"Sequoia Capital China, Qiming Venture Partners, Tencent Holdings",,,,,,,
IRL,$1.17 ,6/15/21,United States,San Francisco,Internet software & services,"Goodwater Capital, Floodgate, Founders Fund",,,,,,,
Modern Health,$1.17 ,2/11/21,United States,San Francisco,Health,"Kleiner Perkins Caufield & Byers, Afore Capital, Founders Fund",,,,,,,
Yimidida,$1.17 ,1/14/19,China,Shanghai,"Supply chain, logistics, & delivery","Source Code Capital, Global Logistic Properties, K2VC",,,,,,,
SOURCE Global,$1.16 ,4/29/22,United States,Scottsdale,Other,"Breakthrough Energy Ventures, Material Impact, 3x5 Special Opportunity Partners",,,,,,,
Tuhu,$1.16 ,9/15/18,China,Shanghai,Auto & transportation,"Qiming Venture Partners, Yaxia Automobile, Far East Horizon",,,,,,,
Younited,$1.16 ,12/8/22,France,Paris,Fintech,"Weber Investissements, Schibsted Growth",,,,,,,
CloudBees,$1.15 ,12/9/21,United States,San Jose,Data management & analytics,"Matrix Partners, Lightspeed Venture Partners, Verizon Ventures",,,,,,,
Elemy,$1.15 ,10/6/21,United States,San Francisco,Health,"General Catalyst, Bling Capital, Felicis Ventures",,,,,,,
Guideline,$1.15 ,6/16/21,United States,San Mateo,Fintech,"Pelion Venture Partners, Foundation Capital, Thoma Bravo",,,,,,,
Happy Money,$1.15 ,2/8/22,United States,Tustin,Fintech,"FirstMark Capital, Anthemis, CMFG Ventures",,,,,,,
LifeMiles,$1.15 ,7/13/15,Colombia,Bogota,Other,Advent International,,,,,,,
Rebellion Defense,$1.15 ,9/16/21,United States,Washington DC,Artificial intelligence,"Venrock, Innovation Endeavors, Insights Partners",,,,,,,
Venafi,$1.15 ,12/10/20,United States,Salt Lake City,Cybersecurity,"Pelion Venture Partners, Foundation Capital, Thoma Bravo",,,,,,,
DANA,$1.13 ,8/10/22,Indonesia,Jakarta,Fintech,"Ant Group, Lazada, Sinar Mas Indonesia",,,,,,,
At-Bay,$1.12 ,7/27/21,United States,Mountain View,Fintech,"Lightspeed Venture Partners, Khosla Ventures, Munich Re Ventures",,,,,,,
TELD,$1.12 ,12/16/19,China,Qingdao,Fintech,"China Reform Fund, Gaopeng Capital, Jinhui Xingye",,,,,,,
Visby Medical,$1.12 ,3/1/22,United States,San Jose,Health,"Artiman Ventures, Pitango Venture Capital, Valo Ventures",,,,,,,
Acko General Insurance,$1.10 ,10/28/21,India,Bengaluru,Fintech,"Intact Ventures, Munich Re Ventures, General Atlantic",,,,,,,
apna,$1.10 ,9/15/21,India,Bengaluru,Internet software & services,"Sequoia Capital India, Rocketship.vc, Lightspeed India Partners",,,,,,,
AppDirect,$1.10 ,10/7/15,United States,San Francisco,E-commerce & direct-to-consumer,"Mithril, iNovia Capital, Foundry Group",,,,,,,
Beyond Identity,$1.10 ,2/22/22,United States,New York,Cybersecurity,"New Enterprise Associates, Koch Disruptive Technologies, Evolution Equity Partners",,,,,,,
CAIS,$1.10 ,1/11/22,United States,New York,Fintech,"Franklin Templeton, Motive Partners. Apollo Global Management",,,,,,,
Caribou,$1.10 ,5/23/22,United States,Denver,Fintech,"CMFG Ventures, Accomplice, Moderne Ventures",,,,,,,
Carousell,$1.10 ,9/15/21,Singapore,,E-commerce & direct-to-consumer,"500 Global, Rakuten Ventures, Golden Gate Ventures",,,,,,,
Chief,$1.10 ,3/31/22,United States,New York,Other,"General Catalyst, Inspired Capital, Flybridge Capital Partners",,,,,,,
Daily Harvest,$1.10 ,11/16/21,United States,New York,E-commerce & direct-to-consumer,"M13, Lightspeed Venture Partners, Lone Pine Capital",,,,,,,
Enpal,$1.10 ,10/18/21,Germany,Berlin,Internet software & services,"HV Capital, Softbank Group, BlackRock",,,,,,,
eSentire,$1.10 ,2/22/22,Canada,Waterloo,Cybersecurity,"Edison Partners, Georgian Partners, VentureLink",,,,,,,
Firefly Aerospace,$1.10 ,5/4/21,United States,Cedar Park,Other,"XBTO Ventures, Raven One Ventures, SK Ventures",,,,,,,
Fundbox,$1.10 ,11/30/21,United States,San Francisco,Fintech,"Khosla Ventures, General Catalyst, Blumberg Capital",,,,,,,
G2,$1.10 ,6/22/21,United States,Chicago,Internet software & services,"Pritzker Group Venture Capital, Accel, Hyde Park Venture Partners",,,,,,,
Gaussian Robotics,$1.10 ,11/10/21,China,Shanghai,Hardware,"BlueRun Ventures, Grand Flight Investment, Meituan Dianping",,,,,,,
GetYourGuide,$1.10 ,5/16/19,Germany,Berlin,Travel,"Spark Capital, Highland Europe, Sunstone Capital",,,,,,,
GlobalBees,$1.10 ,12/28/21,India,New Delhi,E-commerce & direct-to-consumer,"Chiratae Ventures, SoftBank Group, Trifecta Capital",,,,,,,
Imply Data,$1.10 ,5/17/22,United States,Burlingame,Data management & analytics,"Andreessen Horowitz, Bessemer Venture Partners, Khosla Ventures,",,,,,,,
IntelyCare,$1.10 ,4/6/22,United States,Quincy,Health,"Kaiser Permanente Ventures, Endeavour Vision, LRVHealth",,,,,,,
Invoca,$1.10 ,6/14/22,United States,Santa Barbara,Artificial intelligence,"Upfront Ventures, Accel, Industry Ventures",,,,,,,
Ivalua,$1.10 ,5/21/19,United States,Redwood City,Fintech,"Ardian, Tiger Global Management, KKR",,,,,,,
Juanpi,$1.10 ,4/14/16,China,Wuhan,E-commerce & direct-to-consumer,"Tiantu Capital, SAIF Partners China, Newsion Venture Capital",,,,,,,
Karat,$1.10 ,10/13/21,United States,Seattle,Internet software & services,"8VC, Norwest Venture Partners, Tiger Global Management",,,,,,,
LEAD School,$1.10 ,1/13/22,India,Andheri,Edtech,"WestBridge Capital, GSV Ventures, Elevar Equity",,,,,,,
Material Security,$1.10 ,5/11/22,United States,Redwood City,Cybersecurity,"Andreessen Horowitz, Founders Fund",,,,,,,
Nexthink,$1.10 ,2/8/21,Switzerland,Prilly,Data management & analytics,"Auriga, Galeo Ventures, Highland Europe",,,,,,,
Nowports,$1.10 ,5/24/22,Mexico,Monterrey,"Supply chain, logistics, & delivery","Monashees+, Foundation Capital, Base10 Partners",,,,,,,
OVH,$1.10 ,8/15/16,France,Roubaix,Other,"KKR, TowerBrook Capital Partners",,,,,,,
People.ai,$1.10 ,8/11/21,United States,San Francisco,Internet software & services,"GGV Capital, Lightspeed Venture Partners, ICONIQ Capital",,,,,,,
Pharmapacks,$1.10 ,11/12/20,United States,Islandia,E-commerce & direct-to-consumer,The Carlyle Group,,,,,,,
PhysicsWallah,$1.10 ,6/7/22,India,Uttar Pradesh,Edtech,"GSV Ventures, WestBridge Capital",,,,,,,
Purplle,$1.10 ,6/9/22,India,Mumbai,E-commerce & direct-to-consumer,"Blume Ventures, JSW Ventures, IvyCap Ventures",,,,,,,
Qingting FM,$1.10 ,6/2/21,China,Shanghai,Internet software & services,"China Culture Industrial Investment Fund, We Capital, China Minsheng Investment Group",,,,,,,
Recover,$1.10 ,6/9/22,Spain,Banyeres de Mariola,Other,"Goldman Sachs Asset Management, STORY3 Capital Partners",,,,,,,
Rightway,$1.10 ,3/30/21,United States,New York,Health,"Thrive Capital, Khosla Ventures, Tiger Global Management",,,,,,,
Sennder,$1.10 ,1/14/21,Germany,Berlin,"Supply chain, logistics, & delivery","Accelm Scania Growth Capital, Lakestar",,,,,,,
Sisense,$1.10 ,1/9/20,United States,New York,Data management & analytics,"Opus Capital, Genesis Partners, Battery Ventures",,,,,,,
Staffbase,$1.10 ,3/15/22,Germany,Chemnitz,Internet software & services,"Insight Partners, e.ventures, General Atlantic",,,,,,,
Sunbit,$1.10 ,5/20/21,United States,Los Angeles,Fintech,"Zeev Ventures, Group11, Chicago Ventures",,,,,,,
TangoMe,$1.10 ,3/20/14,United States,Mountain View,Mobile & telecommunications,"Draper Fisher Jurtson, Qualcomm Ventures, Alibaba Group",,,,,,,
Teleport,$1.10 ,5/3/22,United States,Oakland,Cybersecurity,"Kleiner Perkins Caufield & Byers, s28 Capital, Insight Partners",,,,,,,
The Bank of London,$1.10 ,11/30/21,United Kingdom,London,Fintech,"Mangrove Capital Partners,14W. ForgeLight",,,,,,,
Turing,$1.10 ,12/20/21,United States,Palo Alto,Internet software & services,"Foundation Capital, Frontier Ventures, AltaIR Capital",,,,,,,
Wasabi,$1.10 ,9/27/22,United States,Boston,Internet software & services,"Forestay Capital, Alumni Ventures, NTT DoCoMo Ventures",,,,,,,
Zego,$1.10 ,3/9/21,United Kingdom,London,Fintech,"LocalGlobe, Balderton Capital, Target Global",,,,,,,
56PINGTAI,$1.08 ,1/25/21,China,Shanghai,"Supply chain, logistics, & delivery","QF Capital, QC Capital, Unicom Innovation Venture Capital",,,,,,,
Nxin,$1.08 ,9/18/18,China,Beijing,Internet software & services,"Beijing Juneng Hesheng Industry Investment Fund, Beijing Shuju Xinrong Fund",,,,,,,
UISEE Technology,$1.08 ,1/25/21,China,Beijing,"Supply chain, logistics, & delivery","Shenzhen Capital Group, Robert Bosch Venture Capital, SeptWolves Ventures",,,,,,,
Cirkul,$1.07 ,6/13/22,United States,Sarasota,Consumer & retail,"AF Ventures, Siddhi Capital, SC.Holdings",,,,,,,
Mamaearth,$1.07 ,12/28/21,India,Gurgaon,E-commerce & direct-to-consumer,"Fireside Ventures, Sequoia Capital India, Stellaris Venture Partners",,,,,,,
Radius Payment Solutions,$1.07 ,11/27/17,United Kingdom,Crewe,Fintech,Inflexion Private Equity,,,,,,,
Rivigo,$1.07 ,7/11/19,India,Gurgaon,"Supply chain, logistics, & delivery","SAIF Partners India, Warburg Pincus, Trifecta Capital Advisors",,,,,,,
MobileCoin,$1.06 ,7/7/21,United States,San Francisco,Fintech,"General Catalyst, Future Ventures, AU21",,,,,,,
0x,$1.05 ,4/26/22,United States,San Francisco,Fintech,"Jump Capital, Pantera Capital, Greylock Partners",,,,,,,
Branch,$1.05 ,3/1/22,United States,Columbus,Fintech,"American Family Ventures, Greycroft, SignalFire",,,,,,,
Density,$1.05 ,11/10/21,United States,San Francisco,Hardware,"Founders Fund, Upfront Ventures, 01 Advisors",,,,,,,
Instabase,$1.05 ,10/21/19,United States,San Francisco,Data management & analytics,"New Enterprise Associates, Greylock Partners, Andreessen Horowitz",,,,,,,
Jiuxian,$1.05 ,7/30/15,China,Beijing,E-commerce & direct-to-consumer,"Sequoia Capital China, Rich Land Capital, Merrysunny Wealth",,,,,,,
Matrixport,$1.05 ,6/1/21,Singapore,,Fintech,"Dragonfly Captial, Qiming Venture Partners, DST Global",,,,,,,
Mixpanel,$1.05 ,11/15/21,United States,San Francisco,Internet software & services,"Bain Capital Tech Opportunities, Andreessen Horowitz, Sequoia Capital",,,,,,,
Sendbird,$1.05 ,4/6/21,United States,San Mateo,Mobile & telecommunications,"FundersClub, Y Combinator, Tiger Global Management",,,,,,,
Aprogen,$1.04 ,5/31/19,South Korea,Seongnam-Si,Health,"Lindeman Asia Investment, Nichi-Iko Pharmaceutical",,,,,,,
OrCam Technologies,$1.03 ,2/20/18,Israel,Jerusalem,Artificial intelligence,"Intel Capital, Aviv Venture Capital",,,,,,,
Ample,$1.02 ,11/11/21,United States,San Francisco,Hardware,"Shell Ventures, Blackstone, Moore Strategic Ventures",,,,,,,
BlackBuck,$1.02 ,7/22/21,India,Bengaluru,"Supply chain, logistics, & delivery","Accel, Sands Capital, International Finance Corporation",,,,,,,
Leap Motor,$1.01 ,11/20/18,China,Hangzhou,Auto & transportation,"Sequoia Capital China, Gopher Asset Management, Shanghai Electric Group",,,,,,,
Wheel,$1.01 ,1/19/22,United States,Austin,Health,"Silverton Partners, Tusk Ventures, CRV",,,,,,,
1KMXC,$1.00 ,8/30/21,China,Hangzhou,Hardware,"Goldman Sachs Asset Management, SDP Investment, Alibaba Group",,,,,,,
58 Daojia,$1.00 ,10/12/15,China,Beijing,Internet software & services,"KKR, Alibaba Group, Ping An Insurance",,,,,,,
Agile Robots,$1.00 ,9/9/21,Germany,Munich,Hardware,"Hillhouse Capital Management, Sequoia Capital China, Linear Venture",,,,,,,
Aircall,$1.00 ,6/23/21,United States,New York,Internet software & services,"Balderton Capital, Next World Capital, Draper Esprit",,,,,,,
Ajaib,$1.00 ,10/4/21,Indonesia,Jakarta,Fintech,"Softbank Ventures Asia, Alpha JWC Ventures, Insignia Ventures Partners",,,,,,,
Alto Pharmacy,$1.00 ,1/30/20,United States,San Francisco,Health,"Jackson Square Ventures, Greenoaks Capital Management, Softbank Group",,,,,,,
Amount,$1.00 ,5/17/21,United States,Chicago,Fintech,"Invus Group, Hanaco Venture Capital, WestCap Group",,,,,,,
Amperity,$1.00 ,7/13/21,United States,Seattle,Artificial intelligence,"Madrona Venture Group, Tiger Global Management, Madera Technology Partners",,,,,,,
Anyscale,$1.00 ,12/7/21,United States,Berkeley,Artificial Intelligence,"Andreessen Horowitz, Intel Capital, Foundation Capital",,,,,,,
Aptos,$1.00 ,3/15/22,United States,Palo Alto,Internet software & services,"Andreessen Horowitz, Coinbase Ventures, Tiger Global Management",,,,,,,
Aqua Security,$1.00 ,3/10/21,Israel,Ramat Gan,Cybersecurity,"TLV Partners, Lightspeed Venture Partners, M12",,,,,,,
Assembly,$1.00 ,9/21/21,United States,Culver City,Internet software & services,"Advent International, PSG, Providence Equity Partners",,,,,,,
Assent,$1.00 ,1/6/22,Canada,Ottawa,"Supply chain, logistics, & delivery","Vista Equity Partners, Warburg Pincus, First Ascent Ventures",,,,,,,
Augury,$1.00 ,10/26/21,United States,New York,Artificial intelligence,"Lerer Hippeau, Munich Re Ventures, Eclipse Ventures",,,,,,,
Augustinus Bader,$1.00 ,11/9/22,London,United Kingdom,Consumer & retail,General Atlantic,,,,,,,
Axelar,$1.00 ,2/15/22,Canada,Waterloo,Internet software & services,"Lemniscap VC, North Island Ventures, Polychain Capital",,,,,,,
Axiom Space,$1.00 ,2/16/21,United States,Houston,Other,"C5 Capital, Hemisphere Ventures, The Venture Collective",,,,,,,
Axtria,$1.00 ,5/13/21,United States,Berkeley Heights,Data management & analytics,"Helion Venture Partners, Bain Capital Tech Opportunities, Sequoia Capital India",,,,,,,
Banma Network Technologies,$1.00 ,9/13/18,China,Shanghai,Auto & transportation,"Yunfeng Capital, SDIC Innovation Investment Management, Shang Qi Capital",,,,,,,
Beamery,$1.00 ,12/13/22,United Kingdom,London,Artificial intelligence,"Index Ventures, EQT Ventures, Workday Ventures",,,,,,,
BeiBei,$1.00 ,1/22/15,China,Hangzhou,E-commerce & direct-to-consumer,"Banyan Capital, New Horizon Capital, IDG Capital Partners",,,,,,,
Berlin Brands Group,$1.00 ,9/1/21,Germany,Berlin,E-commerce & direct-to-consumer,"Ardian, Bain Capital",,,,,,,
Betterfly,$1.00 ,2/1/22,Chile,Santiago,Artificial intelligence,"QED Investors, DST Global, Endeavor",,,,,,,
BitFury,$1.00 ,11/6/18,Netherlands,Amsterdam,Hardware,"Georgian Co-Investment Fund, iTech Capital, Galaxy Digital",,,,,,,
Bluecore,$1.00 ,8/5/21,United States,New York,Artificial intelligence,"FirstMark Capital, Georgian Partners, Norwest Venture Partners",,,,,,,
BlueVoyant,$1.00 ,2/23/22,United States,New York,Cybersecurity,"8VC, Liberty Strategic Capital, Eden Global Partners",,,,,,,
Boom Supersonic,$1.00 ,12/16/20,United States,Englewood,Other,"WRVI Capital, Caffeinated Capital, Y Combinator",,,,,,,
BostonGene,$1.00 ,4/6/22,United States,Waltham,Health,"Japan Industrial Partners, Impact Investment Capital, NEC",,,,,,,
Bringg,$1.00 ,6/16/21,Israel,Tel Aviv,"Supply chain, logistics, & delivery","Salesforce Ventures, next47, Pereg Ventures",,,,,,,
C2FO,$1.00 ,8/7/19,United States,Leawood,Fintech,"Union Square Ventures, Summerhill Venture Partners, Mithril Capital Management",,,,,,,
Cadence,$1.00 ,12/14/21,United States,New York,Health,"Thrive Capital, General Catalyst, Coatue Management",,,,,,,
Cameo,$1.00 ,3/30/21,United States,Chicago,Internet software & services,"Lightspeed Venture Partners, Kleiner Perkins Caufield & Byers, Origin Ventures",,,,,,,
Capsule,$1.00 ,4/28/21,United States,New York,Health,"Thrive Capital, Durable Capital Partners, G Squared",,,,,,,
CareBridge,$1.00 ,6/8/22,United States,Nashville,Health,"Bain Capital Ventures, Splunk Ventures, Cisco Investments",,,,,,,
CargoX,$1.00 ,10/21/21,Brazil,Sao Paulo,"Supply chain, logistics, & delivery","Valor Capital Group, Lightrock, Softbank Group",,,,,,,
Carro,$1.00 ,6/14/21,Singapore,,E-commerce & direct-to-consumer,"SingTel Innov8, Alpha JWC Ventures, Golden Gate Ventures",,,,,,,
Carson Group,$1.00 ,7/14/21,United States,Lincoln,Fintech,Bain Capital,,,,,,,
Celestia,$1.00 ,10/19/22,Liechtenstein,Vaduz,Internet software & services,"Placeholder Capital, Coinbase Ventures, Binance Ventures",,,,,,,
Cell C,$1.00 ,8/7/17,South Africa,Midrand,Mobile & telecommunications,"Blue Label Telecoms, Net1 UEPS Technologies",,,,,,,
CHEQ,$1.00 ,2/22/22,United States,New York,Cybersecurity,"Battery Ventures, Tiger Global Management, Hanaco Ventures",,,,,,,
China Cloud,$1.00 ,6/11/18,China,Wuxi,Hardware,"V Star Capital, GF Xinde Investment Management Co., Haitong Leading Capital Management",,,,,,,
Chronosphere,$1.00 ,10/7/21,United States,New York,Data management & analytics,"Greylock Partners, Lux Capital, General Atlantic",,,,,,,
Cider,$1.00 ,9/2/21,Hong Kong,,E-commerce & direct-to-consumer,"Andreessen Horowitz, DST Global, IDG Capital",,,,,,,
Clara,$1.00 ,12/6/21,Mexico,Mexico City,Fintech,"DST Global, General Catalyst, Monashees+",,,,,,,
Claroty,$1.00 ,6/17/21,United States,New York,Cybersecurity,"Bessemer Venture Partners, MoreVC, Team8",,,,,,,
Clearcover,$1.00 ,4/13/21,United States,Chicago,Fintech,"American Family Ventures, Cox Enterprises, OMERS Ventures",,,,,,,
CommerceIQ,$1.00 ,3/21/22,United States,Palo Alto,Artificial Intelligence,"Trinity Ventures, Madrona Venture Group, Shasta Ventures",,,,,,,
Contrast Security,$1.00 ,11/9/21,United States,Los Altos,Cybersecurity,"Acero Capital, General Catalyst, M12",,,,,,,
Darwinbox,$1.00 ,1/25/22,India,Hyderabad,Internet software & services,"Lightspeed India Partners, Sequoia Capital India, Endiya Partners",,,,,,,
Dental Monitoring,$1.00 ,10/21/21,France,Paris,Health,"Vitruvian Partners, Merieux Equity Partners, Straumann",,,,,,,
DianRong,$1.00 ,8/2/17,China,Shanghai,E-commerce & direct-to-consumer,"Standard Chartered, FinSight Ventures, Affirma Capital",,,,,,,
Divergent 3D,$1.00 ,4/25/22,United States,Torrance,Auto & transportation,"Hedosophia, Horizons Ventures, Alumni Ventures Group",,,,,,,
dMed Biopharmaceutical,$1.00 ,7/12/21,China,Shanghai,Health,"Qiming Venture Partners, Vivo Capital, Sequoia Capital China",,,,,,,
Dune Analytics,$1.00 ,2/2/22,Norway,Oslo,Data management & analytics,"Multicoin Capital, Coatue Management, Dragonfly Capital Partners",,,,,,,
Dxy.cn,$1.00 ,4/10/18,China,Hangzhou,Health,"Tencent Holdings, DCM Ventures",,,,,,,
EBANX,$1.00 ,10/16/19,Brazil,Curitiba,Fintech,"FTV Capital, Endeavor",,,,,,,
EcoFlow,$1.00 ,6/10/21,China,Shenzhen,Hardware,"Delian Capital, China International Capital Corporation, Sequoia Capital China",,,,,,,
EcoVadis,$1.00 ,6/14/22,France,Paris,"Supply chain, logistics, & delivery","Astorg Partners, Princeville Global, Beyond Net Zero",,,,,,,
Electric,$1.00 ,3/29/22,United States,New York,Cybersecurity,"Primary Venture Partners, Bessemer Venture Partners, Harmonic Growth Partners",,,,,,,
Emerging Markets Property Group,$1.00 ,4/28/20,United Arab Emirates,Dubai,Other,"OLX Group, KCK Group, EXOR Seeds",,,,,,,
Esusu,$1.00 ,1/27/22,United States,New York,Fintech,"Next Play Ventures, Zeal Capital Partners, SoftBank Group",,,,,,,
Evidation,$1.00 ,3/22/21,United States,San Mateo,Health,"B Capital Group,, GE Ventures, McKesson Ventures",,,,,,,
Expel,$1.00 ,11/18/21,United States,Herndon,Cybersecurity,"Paladin Capital Group, Greycroft, Scale Venture Partners",,,,,,,
Fabric,$1.00 ,10/26/21,United States,New York,"Supply chain, logistics, & delivery","Innovation Endeavors, Aleph, Temasek",,,,,,,
Factorial,$1.00 ,10/11/22,Spain,Barcelona,Internet software & services,"K Fund, Creandum, CRV",,,,,,,
Feedzai,$1.00 ,3/24/21,United States,San Mateo,Artificial intelligence,"Global Founders Capital, Shea Ventures, Greycroft",,,,,,,
Fever Labs,$1.00 ,1/26/22,United States,New York,Internet software & services,"Accel, 14W, GS Growth",,,,,,,
Fiture,$1.00 ,4/14/21,China,Chengdu,Health,"Bertelsmann Asia Investments, Sequoia Capital China, NIO Capital",,,,,,,
FLASH,$1.00 ,3/16/22,United States,Austin,Fintech,"L Catterton, Trellis Partners, Vista Equity Partners",,,,,,,
Flash Express,$1.00 ,2/1/21,Thailand,Bangkok,"Supply chain, logistics, & delivery","SCB 10X, Krungsri Finnovate, eWTP Capital",,,,,,,
FlashEx,$1.00 ,8/27/18,China,Beijing,"Supply chain, logistics, & delivery","Prometheus Capital, Matrix Partners China, JD Capital Management",,,,,,,
Flexe,$1.00 ,4/21/22,United States,Seattle,"Supply chain, logistics, & delivery","Redpoint Ventures, Prologis Ventures, Madrona Venture Group",,,,,,,
Flow,$1.00 ,8/15/22,United States,New York,Fintech,Andreessen Horowitz,,,,,,,
FourKites,$1.00 ,6/21/22,United States,Chicago,"Supply chain, logistics, & delivery","Hyde Park Venture Partners, Bain Capital Ventures, Hyde Park Angels",,,,,,,
Fractal Analytics,$1.00 ,1/5/22,India,Mumbai,Data management & analytics,"TPG Capital, Apax Partners, TA Associates",,,,,,,
Freshbooks,$1.00 ,8/10/21,Canada,Toronto,Fintech,"Accomplice, Oak Investment Partners, Georgian Partners",,,,,,,
FXiaoKe,$1.00 ,7/2/15,China,Beijing,Mobile & telecommunications,"IDG Capital, Northern Light Venture Capital, DCM Ventures",,,,,,,
Gauntlet Networks,$1.00 ,3/7/22,United States,New York,Fintech,"Polychain Capital, Paradigm, Ribbit Capital",,,,,,,
Gelato,$1.00 ,8/16/21,Norway,Oslo,E-commerce & direct-to-consumer,"Greylock Partners, Google Ventures, BlackRock",,,,,,,
Genies,$1.00 ,4/12/22,United States,Venice,Internet software & services,"New Enterprise Associates, Tull Investment Group, Silver Lake",,,,,,,
Glean,$1.00 ,5/18/22,United States,Palo Alto,Internet software & services,"General Catalyst, Kleiner Perkins Caufield & Byers, Lightspeed Venture Partners",,,,,,,
Glia,$1.00 ,3/21/22,United States,New York,Fintech,"Wildcat Capital Management, Insight Partners, Tola Capital",,,,,,,
Globality,$1.00 ,1/22/19,United States,Menlo Park,Artificial intelligence,SoftBank Group,,,,,,,
