Company,Valuation ($B),Date Joined,Country,City,Industry,Select Investors,,,,,,,
MoMo,$2.27 ,12/10/21,Vietnam,Ho Chi Minh City,Fintech,"Goodwater Capital, Warburg Pincus, GS Growth",,,,,,,
Algolia,$2.25 ,7/28/21,United States,San Francisco,Internet software & services,"Accel, Alven Capital, Storm Ventures",,,,,,,
Pattern,$2.25 ,10/6/21,United States,Lehi,Internet software & services,"Knox Lane, Ainge Advisory, Carlson Private Capital Partners",,,,,,,
UpGrad,$2.25 ,8/9/21,India,Mumbai,Edtech,"Qualcomm Ventures, Accel, Canaan Partners",,,,,,,
Zume,$2.25 ,11/1/18,United States,Mountain View,Consumer & retail,"Softbank Group, AME Cloud Ventures, SignalFire",,,,,,,
Bitso,$2.20 ,5/5/21,Mexico,Mexico City,Fintech,"Pantera Capital, QED Investors, Coinbase Ventures",,,,,,,
BloomReach,$2.20 ,2/23/22,United States,Mountain View,Artificial intelligence,"Bain Capital Ventures, Sixth Street Growth, Lightspeed Venture Partners",,,,,,,
Current,$2.20 ,4/27/21,United States,New York,Fintech,"Expa, QED Investors, Foundation Capital",,,,,,,
Dialpad,$2.20 ,10/6/20,United States,San Francisco,Internet software & services,"Andreessen Horowitz, Google Ventures, Section 32",,,,,,,
G7 Networks,$2.20 ,2/15/22,China,Beijing,"Supply chain, logistics, & delivery","Eastern Bell Capital 32, SDIC CMC Investment Management, Trustbridge Partners",,,,,,,
Gympass,$2.20 ,6/12/19,United States,New York,Internet software & services,"General Atlantic, SoftBank Group, Atomico",,,,,,,
Motif FoodWorks,$2.20 ,6/16/21,United States,Boston,Consumer & retail,"General Atlantic, Breakthrough Energy Ventures, Viking Global Investors",,,,,,,
MUSINSA,$2.20 ,11/11/19,South Korea,Seoul,E-commerce & direct-to-consumer,Sequoia Capital,,,,,,,
Newfront Insurance,$2.20 ,4/12/22,United States,San Francisco,Fintech,"Founders Fund, Meritech Capital Partners, GS Growth",,,,,,,
NuCom Group,$2.20 ,2/22/18,Germany,Unterfoehring,Other,General Atlantic,,,,,,,
Accelerant,$2.19 ,1/12/22,United Kingdom,Colchester,Other,"Deer Park Road, Altamont Capital Partners, Eldridge",,,,,,,
Huaqin Telecom Technology,$2.19 ,10/8/19,China,Shanghai,Mobile & telecommunications,"Zhangjiang Haocheng Venture Capital, Walden International, Intel Capital",,,,,,,
Hesai Tech,$2.18 ,8/1/20,China,Shanghai,Artificial intelligence,"Lightspeed China Partners, Baidu Ventures, Qiming Venture Partners",,,,,,,
Addepar,$2.17 ,6/15/21,United States,Mountain View,Fintech,"8VC, D1 Capital Partners, Sway Ventures",,,,,,,
Qualia,$2.17 ,12/21/20,United States,San Francisco,Fintech,"8VC, Menlo Ventures, Tiger Global Management",,,,,,,
YITU Technology,$2.17 ,3/8/18,China,Shanghai,Artificial intelligence,"Sequoia Capital China, Banyan Capital",,,,,,,
CloudWalk,$2.15 ,9/8/21,Brazil,Sao Paulo,Fintech,"Plug and Play Ventures, Valor Capital Group, DST Global",,,,,,,
CoinDCX,$2.15 ,8/10/21,India,Maharashtra,Fintech,"Polychain Capital, Coinbase Ventures, Jump Capital",,,,,,,
Aledade,$2.10 ,1/19/21,United States,Bethesda,Health,"Venrock, CVF Capital Partners, ARCH Venture Partners",,,,,,,
Eightfold.ai,$2.10 ,10/27/20,United States,Santa Clara,Internet software & services,"Foundation Capital, Institutional Venture Partners, General Catalyst",,,,,,,
FirstCry,$2.10 ,2/7/20,India,Pune,E-commerce & direct-to-consumer,"SoftBank Group, SAIF Partners India, Valiant Capital Partners",,,,,,,
Forto,$2.10 ,6/21/21,Germany,Berlin,"Supply chain, logistics, & delivery","Cherry Ventures, Northzone Ventures, Global Founders Capital",,,,,,,
GoCardless,$2.10 ,2/8/22,United Kingdom,London,Fintech,"Accel, Passion Capital, Balderton Capital",,,,,,,
Jeeves,$2.10 ,3/14/22,United States,Orlando,Fintech,"Tencent Holdings, CRV, Clocktower Technology Ventures",,,,,,,
Medable,$2.10 ,10/26/21,United States,Palo Alto,Health,"GSR Ventures, Sapphire Ventures, Streamlined Ventures",,,,,,,
Moveworks,$2.10 ,6/30/21,United States,Mountain View,Artificial intelligence,"Lightspeed Venture Partners, Sapphire Ventures, Kleiner Perkins Caufield & Byers",,,,,,,
PayFit,$2.10 ,1/6/22,United Kingdom,London,Fintech,"Accel, frst, Kima Ventures",,,,,,,
ReCharge,$2.10 ,5/6/21,United States,Los Angeles,Fintech,"ICONIQ Growth, Bain Capital Ventures, Summit Partners",,,,,,,
Urban Company,$2.10 ,4/27/21,India,Gurgaon,E-commerce & direct-to-consumer,"VY Capital, Accel, Elevation Capital",,,,,,,
21.co,$2.00 ,9/6/22,United States,New York,Fintech,"Quiet Ventures, ETFS Capital, Collab+Currency",,,,,,,
4Paradigm,$2.00 ,12/19/18,China,Beijing,Artificial intelligence,"Sequoia Capital China, China Construction Bank, Bank of China",,,,,,,
Advance Intelligence Group,$2.00 ,9/23/21,Singapore,,Artificial intelligence,"Vision Plus Capital, GSR Ventures, ZhenFund",,,,,,,
Akulaku,$2.00 ,2/15/22,Indonesia,Jakarta,E-commerce & direct-to-consumer,"DCM Ventures, IDG Capital, Siam Commercial Bank",,,,,,,
Apeel Sciences,$2.00 ,5/26/20,United States,Goleta,Other,"Upfront Ventures, Tao Capital Partners, Andreessen Horowitz",,,,,,,
AppsFlyer,$2.00 ,1/21/20,United States,San Francisco,Mobile & telecommunications,"Magma Venture Partners, Pitango Venture Capital, Qumra Capital",,,,,,,
Avant,$2.00 ,12/17/12,United States,Chicago,Artificial intelligence,"RRE Ventures, Tiger Global, August Capital",,,,,,,
Aviatrix,$2.00 ,9/8/21,United States,Santa Clara,Internet software & services,"Ignition Partners, Formation 8, CRV",,,,,,,
Babel Finance,$2.00 ,5/25/22,Hong Kong,Hong Kong,Fintech,"Dragonfly Capital, BAI Capital, 10T Fund",,,,,,,
Beisen,$2.00 ,5/11/21,China,Beijing,Internet software & services,"Matrix Partners China, Sequoia Capital China, Genesis Capital",,,,,,,
BeZero,$2.00 ,11/14/22,United Kingdom,London,Other,"Molten Ventures, Contrarian Ventures, Hitachi Ventures",,,,,,,
BlaBlaCar,$2.00 ,9/16/15,France,Paris,Auto & transportation,"Accel Partners, Index Ventures, Insight Venture Partners",,,,,,,
Black Sesame Technologies,$2.00 ,9/22/21,China,Shanghai,Artificial intelligence,"Northern Light Venture Capital, Xiaomi, FutureX Capital",,,,,,,
Bunq,$2.00 ,6/18/21,Netherlands,Amsterdam,Fintech,Undisclosed,,,,,,,
Calm,$2.00 ,2/6/19,United States,San Francisco,Internet software & services,"Insight Venture Partners, TPG Growth, Sound Ventures",,,,,,,
CertiK,$2.00 ,3/31/22,United States,New York,Cybersecurity,"Tiger Global Management, Lightspeed Venture Partners, Hillhouse Capital Management",,,,,,,
Chipper Cash,$2.00 ,5/31/21,United States,San Francisco,Fintech,"Deciens Capital, Bezos Expeditions, 500 Startups",,,,,,,
Clearco,$2.00 ,4/20/21,Canada,Toronto,Fintech,"Highland Capital Partners, Oak HC/FT Partners, Emergence Capital Partners",,,,,,,
ClickHouse,$2.00 ,10/28/21,United States,Portola Valley,Data management & analytics,"Lightspeed Venture Partners, Almaz Capital Partners, Altimeter Capital",,,,,,,
Clip,$2.00 ,6/10/21,Mexico,Mexico City,Fintech,"Alta Ventures Mexico, General Atlantic, SoftBank Group",,,,,,,
Cloudinary,$2.00 ,2/15/22,United States,Santa Clara,Internet software & services,"Blackstone, Bessemer Venture Partners",,,,,,,
Devo Technology,$2.00 ,10/26/21,United States,Cambridge,Data management & analytics,"Insight Partners, Kibo Ventures, Bessemer Venture Partners",,,,,,,
Divvy Homes,$2.00 ,8/13/21,United States,San Francisco,Fintech,"Andreessen Horowitz, Caffeinated Capital, SciFi VC",,,,,,,
Drata,$2.00 ,11/8/21,United States,San Diego,Cybersecurity,"Cowboy Ventures, Leaders Fund, GGV Capital",,,,,,,
Dremio,$2.00 ,1/6/21,United States,Santa Clara,Data management & analytics,"Lightspeed Venture Partners, Redpoint Ventures, Norwest Venture Partners",,,,,,,
Druva,$2.00 ,6/20/19,United States,Sunnyvale,Data management & analytics,"Nexus Venture Partners, Tenaya Capital, Sequoia Capital",,,,,,,
Earnix,$2.00 ,2/21/21,Israel,Giv'atayim,Fintech,"Jerusalem Venture Partners, Israel Growth Partners, Insight Partners",,,,,,,
Everlaw,$2.00 ,3/10/20,United States,Oakland,Internet software & services,"K9 Ventures, Menlo Ventures, Andreessen Horowitz",,,,,,,
Exotec,$2.00 ,1/17/22,France,Croix,Hardware,"Breega Capital, Iris Capital, 360 Capital Partners",,,,,,,
Formlabs,$2.00 ,8/1/18,United States,Somerville,Hardware,"Pitango Venture Capital, DFJ Growth Fund, Foundry Group",,,,,,,
Geek+,$2.00 ,11/21/18,China,Beijing,Hardware,"Volcanics Ventures, Vertex Ventures China, Warburg Pincus",,,,,,,
GO1,$2.00 ,7/19/21,Australia,Brisbane,Internet software & services,"Y Combinator, M12, SEEK",,,,,,,
GrubMarket,$2.00 ,9/14/21,United States,San Francisco,E-commerce & direct-to-consumer,"GGV Capital, BlackRock, ACE & Company",,,,,,,
Guoquan Shihui,$2.00 ,3/17/21,China,Shanghai,Consumer & retail,"Tiantu Capital, CMB International Capital, Vision Knight Capital",,,,,,,
Hive,$2.00 ,4/21/21,United States,San Francisco,Artificial intelligence,"Tomales Bay Capital, Bain & Company, General Catalyst",,,,,,,
Hugging Face,$2.00 ,5/9/22,United States,New York,Artificial intelligence,"Betaworks Ventures, Addition, Lux Capital",,,,,,,
HuiMin,$2.00 ,9/5/16,China,Beijing,E-commerce & direct-to-consumer,"Zheshang Venture Capital, GP Capital, Western Capital Management",,,,,,,
ISN,$2.00 ,12/17/20,United States,Dallas,"Supply chain, logistics, & delivery",Blackstone,,,,,,,
Iterable,$2.00 ,6/15/21,United States,San Francisco,Internet software & services,"CRV, Blue Cloud Ventures, Index Ventures",,,,,,,
Kajabi,$2.00 ,5/4/21,United States,Irvine,Internet software & services,"Meritech Capital Partners, Tiger Global Management, Spectrum Equity",,,,,,,
Kaseya,$2.00 ,3/27/19,United States,Miami,Cybersecurity,"Insight Partners, TPG Alternative & Renewable Technologies, Ireland Strategic Investment Fund",,,,,,,
Keep,$2.00 ,5/19/20,China,Beijing,Internet software & services,"Bertelsmann Asia Investments, GGV Capital, Morningside Venture Capital",,,,,,,
KRY,$2.00 ,4/27/21,Sweden,Stockholm,Health,"Index Ventures, Creandum, Accel",,,,,,,
Kujiale,$2.00 ,10/25/19,China,Hangzhou,Internet software & services,"GGV Capital, IDG Capital, Linear Venture",,,,,,,
Loggi,$2.00 ,6/5/19,Brazil,Sao Paulo,"Supply chain, logistics, & delivery","Qualcomm Ventures, SoftBank Group. Monashees+",,,,,,,
LTK,$2.00 ,11/22/21,United States,Dallas,Internet software & services,"SoftBank Group, Maverick Capital",,,,,,,
Lunar,$2.00 ,7/12/21,Denmark,Aarhus,Fintech,"SEED Capital, Greyhound Capital, Socii Capital",,,,,,,
Mafengwo,$2.00 ,5/23/19,China,Beijing,Travel,"Qiming Venture Partners, Capital Today, General Atlantic",,,,,,,
Magic Leap,$2.00 ,10/21/14,United States,Plantation,Hardware,"Obvious Ventures, Qualcomm Ventures, Andreessen Horowitz",,,,,,,
Misfits Market,$2.00 ,4/21/21,United States,Pennsauken,"Supply chain, logistics, & delivery","Accel, D1 Capita Partners, Greenoaks Capital Management",,,,,,,
Modern Treasury,$2.00 ,10/6/21,United States,San Francisco,Fintech,"Benchmark, Altimeter Capital, Quiet Capital",,,,,,,
MURAL,$2.00 ,7/20/21,United States,San Francisco,Internet software & services,"Insight Partners, Tiger Global Management, Gradient Ventures",,,,,,,
Mynt,$2.00 ,11/1/21,Philippines,Taguig City,Fintech,"Insight Partners, Warburg Pincus, Ayala Corporation",,,,,,,
Mysten Labs,$2.00 ,9/8/22,United States,San Francisco,Internet software & services,"Andreessen Horowitz, Coinbase Ventures, Circle Ventures",,,,,,,
Neo4j,$2.00 ,6/17/21,United States,San Mateo,Data management & analytics,"Eight Roads Ventures, One Peak Partners, Creandum",,,,,,,
Netlify,$2.00 ,11/17/21,United States,San Francisco,Internet software & services,"Andreessen Horowitz, Kleiner Perkins Caufield & Byers, EQT Ventures",,,,,,,
OCSiAl,$2.00 ,3/4/19,Luxembourg,Leudelange,Other,"A&NN, Rusnano",,,,,,,
Opay,$2.00 ,8/23/21,Nigeria,Lagos,Fintech,"Sequoia Capital China, Source Code Capital, Redpoint Ventures China",,,,,,,
Pipe,$2.00 ,5/19/21,United States,Miami,Fintech,"next47, MaC Venture Capital, FinVC",,,,,,,
Preferred Networks,$2.00 ,5/17/18,Japan,Tokyo,Artificial intelligence,"Toyota Motor Corporation, Mizuho Financial Group, FANUC",,,,,,,
Quora,$2.00 ,4/21/17,United States,Mountain View,Internet software & services,"Y Combinator, Matrix Partners, Benchmark",,,,,,,
Redis Labs,$2.00 ,8/25/20,United States,Mountain View,Data management & analytics,"Viola Ventures, Dell Technologies Capital, Bain Capital Ventures",,,,,,,
Rimac Automobili,$2.00 ,6/1/22,Croatia,Sveta Nedelja,Auto & transportation,"Porsche, InvestIndustrial, SoftBank Group",,,,,,,
ROX Motor,$2.00 ,4/29/22,China,Shanghai,Auto & transportation,"Sequoia Capital China, IDG Capital, Qiming Venture Partners",,,,,,,
Salsify,$2.00 ,4/13/22,United States,Boston,Internet software & services,"Matrix Partners, North Bridge Venture Partners, Venrock",,,,,,,
SmartNews,$2.00 ,8/5/19,Japan,Tokyo,Mobile & telecommunications,"Japan Post Capital, Globis Capital Partners, Atomico",,,,,,,
Solugen,$2.00 ,9/10/21,United States,Houston,Other,"Fifty Years Fund, Refactor Capital, Temasek",,,,,,,
Spring Health,$2.00 ,9/16/21,United States,New York,Health,"Rethink Impact, Work-Bench, RRE Ventures",,,,,,,
SWORD Health,$2.00 ,11/22/21,United States,New York,Health,"Khosla Ventures, Green Innovations, Founders Fund",,,,,,,
Tier,$2.00 ,10/25/21,Germany,Berlin,Travel,"Northzone Ventures, White Star Capital, Novator Partners",,,,,,,
Trax,$2.00 ,7/22/19,Singapore,,Artificial intelligence,"Hopu Investment Management, Boyu Capital, DC Thomson Ventures",,,,,,,
Trendy Group International,$2.00 ,2/13/12,Hong Kong,Kowloon,Consumer & retail,L Capital Partners,,,,,,,
Tubatu.com,$2.00 ,3/9/15,China,Shenzhen,E-commerce & direct-to-consumer,"Sequoia Capital China, Matrix Partners China, 58.com",,,,,,,
Unqork,$2.00 ,10/6/20,United States,New York,Fintech,"Blackrock, capitalG, World Lab Innovation",,,,,,,
VerbIT,$2.00 ,6/8/21,United States,New York,Artificial intelligence,"ClalTech, Vertex Ventures, Oryzn Capital",,,,,,,
Virta Health,$2.00 ,12/2/20,United States,San Francisco,Health,"Caffeinated Capital, Obvious Ventures, Venrock",,,,,,,
Xinchao Media,$2.00 ,4/9/18,China,Chengdu,Internet software & services,"JD.com, Baidu, Vision Plus Capital",,,,,,,
Xingyun Group,$2.00 ,9/24/20,China,Shenzhen,E-commerce & direct-to-consumer,"Matrix Partners China, Eastern Bell Capital, Hongtai Capital Holdings",,,,,,,
XtalPi,$2.00 ,8/11/21,China,Shenzhen,Artificial intelligence,"Tencent Holdings, 5Y Capital, Sequoia Capital China",,,,,,,
Zilch,$2.00 ,11/10/21,United Kingdom,London,Fintech,"Gauss Ventures, Ventura Capital, dmg ventures",,,,,,,
Ankorstore,$1.98 ,1/10/22,France,Paris,E-commerce & direct-to-consumer,"Global Founders Capital, Aglae Ventures, Alven Capital",,,,,,,
Fenbi Education,$1.95 ,2/7/21,China,Beijing,Edtech,"Trustbridge Partners, Hony Capital, IDG Capital",,,,,,,
Roofstock,$1.94 ,3/10/22,United States,Oakland,Fintech,"Khosla Ventures, Bain Capital Ventures, Lightspeed Venture Partners",,,,,,,
thatgamecompany,$1.94 ,3/3/22,United States,Los Angeles,Internet software & services,"Benchmark, Sequoia Capital, TPG Capital",,,,,,,
ZigBang,$1.93 ,6/7/22,South Korea,Seoul,Mobile & telecommunications,"Black Pearl Ventures, Stonebridge Ventures, Yuanta Investment Korea",,,,,,,
Acorns,$1.90 ,3/9/22,United States,Irvine,Fintech,"e.ventures, Bain Capital Ventures, Greycroft",,,,,,,
CoinSwitch Kuber,$1.90 ,10/6/21,India,Bangalore,Fintech,"Tiger Global Management, Sequoia Capital India, Ribbit Capital",,,,,,,
ConcertAI,$1.90 ,3/29/22,United States,Boston,Artificial Intelligence,"Sixth Street Partners, Declaration Partners, Maverick Ventures Israel",,,,,,,
eDaili,$1.90 ,2/1/19,China,Shanghai,E-commerce & direct-to-consumer,"K2VC, Lightspeed China Partners, Sky9 Capital",,,,,,,
InVision,$1.90 ,11/1/17,United States,New York,Internet software & services,"FirstMark Capital, Tiger Global Management, ICONIQ Capital",,,,,,,
Material Bank,$1.90 ,5/6/22,United States,Boca Raton,E-commerce & direct-to-consumer,"Bain Capital Ventures, SoftBank Group, Fifth Wall Ventures",,,,,,,
MX Technologies,$1.90 ,1/13/21,United States,Lehi,Fintech,"Point72 Ventures, Pelion Venture Partners, Commerce Ventures",,,,,,,
Volocopter,$1.87 ,3/4/22,Germany,Bruchsal,Auto & transportation,"btov Partners, Geely, Intel Capital",,,,,,,
CFGI,$1.85 ,9/15/21,United States,Boston,Fintech,"The Carlyle Group, CVC Capital Partners",,,,,,,
ENOVATE,$1.85 ,4/15/19,China,Shanghai,Auto & transportation,Automobile Industry Guidance Fund,,,,,,,
MEGAZONE,$1.83 ,8/16/22,South Korea,Seoul,Internet software & services,"Salesforce Ventures, ATP Investment, kt investment",,,,,,,
Diamond Foundry,$1.80 ,3/29/21,United States,San Francisco,Other,"Fashion Tech Lab, Fidelity Investments, Vast Ventures",,,,,,,
FullStory,$1.80 ,8/4/21,United States,Atlanta,Internet software & services,"Google Ventures, Kleiner Perkins Caufield & Byers, Stripes Group",,,,,,,
Lightricks,$1.80 ,7/31/19,Israel,Jerusalem,Artificial intelligence,"Viola Ventures, Insight Partners, ClalTech, Goldman Sachs",,,,,,,
Opentrons,$1.80 ,9/23/21,United States,New York,Hardware,"SOSV, Khosla Ventures, Lerer Hippeau",,,,,,,
Orca Security,$1.80 ,3/23/21,United States,Portland,Cybersecurity,"YL Ventures, Redpoint Ventures, GGV Capital",,,,,,,
Slice,$1.80 ,11/28/21,India,Bengaluru,Fintech,"Gunosy Capital, Blume Ventures, Das Capital",,,,,,,
ZocDoc,$1.80 ,8/20/15,United States,New York,Health,"Founders Fund, Khosla Ventures, Goldman Sachs",,,,,,,
Cambrian BioPharma,$1.79 ,10/26/21,United States,Brooklyn,Health,"Future Ventures, Apeiron Investment Group, Moore Capital Management",,,,,,,
AIWAYS,$1.78 ,4/16/18,China,Shanghai,Auto & transportation,"Jiangsu Sha Steel Group, Shanghai Puyin Industry, Funa Yuanchuang Technology",,,,,,,
Crusoe,$1.75 ,4/21/22,United States,Denver,Internet software & services,"Bain Capital Ventures, Founders Fund, Winklevoss Capital",,,,,,,
Spinny,$1.75 ,11/24/21,India,Gurugram,E-commerce & direct-to-consumer,"General Catalyst, Eleation Capital, Avenir Growth Capital",,,,,,,
Trulioo,$1.75 ,6/7/21,Canada,Vancouver,Cybersecurity,"Blumberg Capital, American Express Ventures, BDC Venture Capital",,,,,,,
Apus Group,$1.73 ,1/16/15,China,Beijing,Mobile & telecommunications,"Redpoint Ventures, QiMing Venture Partners, Chengwei Capital",,,,,,,
Forte Labs,$1.73 ,5/12/21,United States,San Francisco,Fintech,"Iris Capital, Accel, Elaia Partners",,,,,,,
Productboard,$1.73 ,2/2/22,United States,San Francisco,Internet software & services,"Index Ventures, Kleiner Perkins Caufield & Byers, Bessemer Venture Partners",,,,,,,
Alation,$1.70 ,6/3/21,United States,Redwood City,Internet software & services,"Costanoa Ventures, Data Collective, Salesforce Ventures",,,,,,,
AlphaSense,$1.70 ,6/15/22,United States,New York,Artificial intelligence,"Viking Global Investors, GS Growth, BlackRock",,,,,,,
Carsome,$1.70 ,7/12/21,Malaysia,Selangor,E-commerce & direct-to-consumer,"Gobi Partners, 500 Startups, Ondine Capital",,,,,,,
CircleCI,$1.70 ,5/11/21,United States,San Francisco,Internet software & services,"Threshold Ventures, Baseline Ventures, Harrison Metal",,,,,,,
DealShare,$1.70 ,1/27/22,India,Bengaluru,E-commerce & direct-to-consumer,"Alpha Wave Global, Matrix Partners India, Tiger Global Management",,,,,,,
DispatchHealth,$1.70 ,3/3/21,United States,Denver,Health,"Alta Partners, Questa Capital, Echo Health Ventures",,,,,,,
Dragos,$1.70 ,10/28/21,United States,Hanover,Cybersecurity,"DataTribe, Energy Impact Partners, AllegisCyber Capital",,,,,,,
Front,$1.70 ,6/28/22,United States,San Francisco,Internet software & services,"Sequoia Capital, Uncork Capital, Salesforce Ventures",,,,,,,
Gousto,$1.70 ,11/3/20,United Kingdom,London,"Supply chain, logistics, & delivery","MMC Ventures, BGF Ventures, Unilever Ventures",,,,,,,
H2O.ai,$1.70 ,11/7/21,United States,Mountain View,Artificial intelligence,"Nexus Venture Partners, Transamerica Ventures, Crane Venture Partners",,,,,,,
Harry's,$1.70 ,2/16/18,United States,New York,Consumer & retail,"Thrive Capital, Tiger Global Management, Temasek",,,,,,,
HomeLight,$1.70 ,9/2/21,United States,San Francisco,Fintech,"Zeev Ventures, Menlo Ventures,Crosslink Capital",,,,,,,
Multiverse,$1.70 ,6/8/22,United Kingdom,London,Edtech,"Lightspeed Venture Partners, Google Ventures, General Catalyst",,,,,,,
PAX,$1.70 ,10/22/18,United States,San Francisco,Consumer & retail,"Tao Capital Partners, Global Asset Capital, Tiger Global Management",,,,,,,
Pax8,$1.70 ,4/11/22,United States,Greenwood Village,Internet software & services,"Liberty Global Ventures, Sageview Capital, Blue Cloud Ventures",,,,,,,
Redesign Health,$1.70 ,9/13/22,United States,New York,Health,"General Catalyst, Samsung NEXT, CVS Health Partners",,,,,,,
Reltio,$1.70 ,11/4/21,United States,Redwood City,Data management & analytics,"Crosslink Capital, .406 Ventures, Sapphire Ventures",,,,,,,
Spotter,$1.70 ,2/16/22,United States,Los Angeles,Fintech,"SoftBank Group, Access Industries, Crossbeam Venture Partners",,,,,,,
Vestiaire Collective,$1.70 ,3/1/21,France,Paris,E-commerce & direct-to-consumer,"Eurazeo, IDInvest Partners, Balderton Capital",,,,,,,
Wave,$1.70 ,9/7/21,Senegal,Dakar,Fintech,"Stripe, Founders Fund, Partech Partners",,,,,,,
ZenBusiness,$1.70 ,11/9/21,United States,Austin,Fintech,"Greycroft, Lerer Hippeau, Geekdom Fund",,,,,,,
Tessera Therapeutics,$1.69 ,4/19/22,United States,Cambridge,Health,"Altitude Life Science Ventures, SoftBank Group, Alaska Permanent Fund",,,,,,,
FinAccel,$1.66 ,8/15/22,Singapore,,Fintech,"Jungle Ventures, Square Peg Capital, OpenSpace Ventures",,,,,,,
Uniswap,$1.66 ,10/13/22,United States,New York,Fintech,"A16z Crypto, Variant Fund, Paradigm",,,,,,,
Glossier,$1.65 ,3/19/19,United States,New York,Consumer & retail,"Forerunner Ventures, Institutional Venture Partners, Thrive Capital",,,,,,,
Incredible Health,$1.65 ,8/17/22,United States,San Francisco,Health,"Obvious Ventures, Andreessen Horowitz, NFX",,,,,,,
Optimism,$1.65 ,3/17/22,United States,San Francisco,Internet software & services,"Paradigm, Huobi Ventures, Andreessen Horowitz",,,,,,,
solarisBank,$1.65 ,7/13/21,Germany,Berlin,Fintech,"Yabeo Capital, SBI Investment, Vulcan Capital",,,,,,,
Jusfoun Big Data,$1.62 ,7/9/18,China,Beijing,Data management & analytics,"Boxin Capital, DT Capital Partners, IDG Capital",,,,,,,
Transcarent,$1.62 ,1/11/22,United States,San Francisco,Health,"Alta Partners, General Catalyst, Jove Equity Partners",,,,,,,
Zhubajie,$1.61 ,6/16/15,China,Chongqing,Internet software & services,"Cybernaut Growth Fund, IDG Capital",,,,,,,
Afiniti,$1.60 ,4/14/17,Bermuda,Hamilton,Artificial intelligence,GAM Holding,,,,,,,
ASAPP,$1.60 ,5/19/21,United States,New York,Artificial intelligence,"March Capital Partners, HOF Capital, Emergence Capital Partners",,,,,,,
Cao Cao Mobility,$1.60 ,1/17/18,China,Hangzhou,Auto & transportation,"People Electrical Appliance Group China, Zhongrong International Trust",,,,,,,
Capitolis,$1.60 ,3/22/22,United States,New York,Fintech,"Sequoia Capital, Index Ventures, S Capital",,,,,,,
Clio,$1.60 ,4/27/21,Canada,Burnaby,Internet software & services,"OMERS Private Equity, T. Rowe Price, Technology Crossover Ventures",,,,,,,
Cresta,$1.60 ,3/17/22,United States,San Francisco,Artificial Intelligence,"Andreessen Horowitz, Greylock Partners, Sequoia Capital",,,,,,,
DataStax,$1.60 ,5/26/21,United States,Santa Clara,Data management & analytics,"Crosslink Capital, Meritech Capital Partners, Lightspeed Venture Partners",,,,,,,
ezCater,$1.60 ,4/2/19,United States,Boston,"Supply chain, logistics, & delivery","Insight Venture Partners, ICONIQ Capital, Launchpad Venture Group",,,,,,,
Infinidat,$1.60 ,4/29/15,United States,Waltham,Hardware,"TPG Growth, Goldman Sachs",,,,,,,
Magic Eden,$1.60 ,6/21/22,United States,San Francisco,Fintech,"Sequoia Capital, Lightspeed Venture Partners, Paradigm",,,,,,,
Mercury,$1.60 ,7/3/21,United States,San Francisco,Fintech,"Andreessen Horowitz, Coatue Management, Clocktower Technology Ventures",,,,,,,
Monte Carlo,$1.60 ,5/24/22,United States,San Francisco,Artificial intelligence,"GGV Capital, Accel, Redpoint Ventures",,,,,,,
Nord Security,$1.60 ,4/7/22,Lithuania,Vilnius,Cybersecurity,"General Catalyst, BaltCap, Novator Partners",,,,,,,
Pave,$1.60 ,6/28/22,United States,San Francisco,Internet software & services,"Y Combinator, Andreessen Horowitz, Bessemer Venture Partners",,,,,,,
SafetyCulture,$1.60 ,5/3/21,Australia,Sydney,Internet software & services,"Blackbird Ventures, IndexVentures, Tiger Global Management",,,,,,,
SmartHR,$1.60 ,6/8/21,Japan,Tokyo,Fintech,"BEENEXT, World Innovation Lab, Light Street Capital",,,,,,,
Tonal,$1.60 ,3/31/21,United States,San Francisco,E-commerce & direct-to-consumer,"Mayfield Fund, Shasta Ventures, L Catterton",,,,,,,
Truepill,$1.60 ,10/27/21,United States,Hayward,Health,"Initialized Capital, Sound Ventures, TI Platform Management",,,,,,,
Unite Us,$1.60 ,3/16/21,United States,New York,Health,"Insight Partners, Sequoia Capital, Index Ventures",,,,,,,
Vanta,$1.60 ,6/7/22,United States,San Francisco,Cybersecurity,"Craft Ventures, Sequoia Capital, Verissimo Ventures",,,,,,,
Wayflyer,$1.60 ,2/1/22,Ireland,Dublin,Fintech,"QED Investors, DST Global, Left Lane Capital",,,,,,,
Promasidor Holdings,$1.59 ,11/8/16,South Africa,Bryanston,Consumer & retail,"IFC, Ajinomoto",,,,,,,
GalaxySpace,$1.58 ,11/17/20,China,Beijing,Mobile & telecommunications,"Shunwei Capital Partners, 5Y Capital, Legend Capital",,,,,,,
Fresh Life Style Supply Chain Management,$1.57 ,3/11/22,China,Chengdu,"Supply chain, logistics, & delivery","Guiyang Venture Capital, Longfor Capital, CAOGENZHIBEN GROUP",,,,,,,
ICON 3D,$1.57 ,2/18/22,United States,Austin,Hardware,"Moderne Ventures, Oakhouse Partners, Bjarke Ingels Group",,,,,,,
Alloy,$1.55 ,9/30/21,United States,New York,Fintech,"Bessemer Venture Partners, Eniac Ventures, Canapi Ventures",,,,,,,
Baiwang,$1.55 ,3/25/19,China,Beijing,Fintech,"Guozhong Venture Capital Management, Shenzhen Capital Group, Oriental Fortune Capital",,,,,,,
